root@comp3134-Winter2024:~# tcpdump -c 5 -i eth0
tcpdump: verbose output suppressed, use -v[v]... for full protocol decode
listening on eth0, link-type EN10MB (Ethernet), snapshot length 262144 bytes
19:52:56.682919 IP comp3134-Winter2024.ssh > 198.96.85.163.5999: Flags [P.], seq 575281023:575281131, ack 1428394740, win 501, length 108
19:52:56.683039 IP comp3134-Winter2024.ssh > 198.96.85.163.5999: Flags [P.], seq 108:264, ack 1, win 501, length 156
19:52:56.683111 IP comp3134-Winter2024.ssh > 198.96.85.163.5999: Flags [P.], seq 264:368, ack 1, win 501, length 104
19:52:56.688163 IP 198.96.85.163.5999 > comp3134-Winter2024.ssh: Flags [.], ack 368, win 255, length 0
19:52:56.782926 IP comp3134-Winter2024.41161 > 67.207.67.2.domain: 7992+ [1au] PTR? 163.85.96.198.in-addr.arpa. (55)
5 packets captured
45 packets received by filter
0 packets dropped by kernel
