root@comp3134-Winter2024:~# tcpdump -i eth0
tcpdump: verbose output suppressed, use -v[v]... for full protocol decode
listening on eth0, link-type EN10MB (Ethernet), snapshot length 262144 bytes
19:50:01.205798 IP comp3134-Winter2024.ssh > 198.96.85.163.5999: Flags [P.], seq 575277719:575277827, ack 1428393724, win 501, length 108
19:50:01.206041 IP comp3134-Winter2024.ssh > 198.96.85.163.5999: Flags [P.], seq 108:144, ack 1, win 501, length 36
19:50:01.206553 IP comp3134-Winter2024.ssh > 198.96.85.163.5999: Flags [P.], seq 144:196, ack 1, win 501, length 52
19:50:01.206627 IP comp3134-Winter2024.ssh > 198.96.85.163.5999: Flags [P.], seq 196:264, ack 1, win 501, length 68
19:50:01.206704 IP comp3134-Winter2024.ssh > 198.96.85.163.5999: Flags [P.], seq 264:368, ack 1, win 501, length 104
19:50:01.218913 IP 198.96.85.163.5999 > comp3134-Winter2024.ssh: Flags [.], ack 368, win 255, length 0
^C
6 packets captured
40 packets received by filter
0 packets dropped by kernel
