root@comp3134-Winter2024:~# tcpdump -i eth0 tcp
tcpdump: verbose output suppressed, use -v[v]... for full protocol decode
listening on eth0, link-type EN10MB (Ethernet), snapshot length 262144 bytes
20:08:06.174407 IP comp3134-Winter2024.ssh > 198.96.85.163.5999: Flags [P.], seq 582756663:582756771, ack 1428413092, win 501, length 108
20:08:06.174564 IP comp3134-Winter2024.ssh > 198.96.85.163.5999: Flags [P.], seq 108:264, ack 1, win 501, length 156
20:08:06.174641 IP comp3134-Winter2024.ssh > 198.96.85.163.5999: Flags [P.], seq 264:332, ack 1, win 501, length 68
20:08:06.174714 IP comp3134-Winter2024.ssh > 198.96.85.163.5999: Flags [P.], seq 332:368, ack 1, win 501, length 36
20:08:06.178981 IP 198.96.85.163.5999 > comp3134-Winter2024.ssh: Flags [.], ack 368, win 513, length 0
^C
5 packets captured
26 packets received by filter
0 packets dropped by kernel
