root@comp3134-Winter2024:~# tcpdump -i eth0 src 159.203.5.106
tcpdump: verbose output suppressed, use -v[v]... for full protocol decode
listening on eth0, link-type EN10MB (Ethernet), snapshot length 262144 bytes
20:09:53.912875 IP comp3134-Winter2024.ssh > 198.96.85.163.5999: Flags [P.], seq 582808115:582808223, ack 1428415732, win 501, length 108
20:09:53.913006 IP comp3134-Winter2024.ssh > 198.96.85.163.5999: Flags [P.], seq 108:264, ack 1, win 501, length 156
20:09:53.913084 IP comp3134-Winter2024.ssh > 198.96.85.163.5999: Flags [P.], seq 264:332, ack 1, win 501, length 68
20:09:53.913154 IP comp3134-Winter2024.ssh > 198.96.85.163.5999: Flags [P.], seq 332:368, ack 1, win 501, length 36
^C
4 packets captured
24 packets received by filter
0 packets dropped by kernel
