root@comp3134-Winter2024:~# tcpdump -r 0001.pcap
reading from file 0001.pcap, link-type EN10MB (Ethernet), snapshot length 262144
20:05:00.296569 IP comp3134-Winter2024.ssh > 198.96.85.163.5999: Flags [P.], seq 582720943:582720987, ack 1428409804, win 501, length 44
20:05:00.296634 IP comp3134-Winter2024.ssh > 198.96.85.163.5999: Flags [P.], seq 44:96, ack 1, win 501, length 52
20:05:00.296718 IP comp3134-Winter2024.ssh > 198.96.85.163.5999: Flags [P.], seq 96:232, ack 1, win 501, length 136
20:05:00.296773 IP comp3134-Winter2024.ssh > 198.96.85.163.5999: Flags [P.], seq 232:268, ack 1, win 501, length 36
20:05:00.300261 IP 198.96.85.163.5999 > comp3134-Winter2024.ssh: Flags [.], ack 268, win 517, length 0
