root@comp3134-Winter2024:~# tcpdump -i eth0 port 22
tcpdump: verbose output suppressed, use -v[v]... for full protocol decode
listening on eth0, link-type EN10MB (Ethernet), snapshot length 262144 bytes

20:08:47.403407 IP comp3134-Winter2024.ssh > 198.96.85.163.5999: Flags [P.], seq 582759187:582759295, ack 1428413604, win 501, length 108
20:08:47.403554 IP comp3134-Winter2024.ssh > 198.96.85.163.5999: Flags [P.], seq 108:264, ack 1, win 501, length 156
20:08:47.403629 IP comp3134-Winter2024.ssh > 198.96.85.163.5999: Flags [P.], seq 264:332, ack 1, win 501, length 68
20:08:47.403776 IP comp3134-Winter2024.ssh > 198.96.85.163.5999: Flags [P.], seq 332:368, ack 1, win 501, length 36
20:08:47.407204 IP 198.96.85.163.5999 > comp3134-Winter2024.ssh: Flags [.], ack 368, win 517, length 0
20:08:47.473463 IP 198.96.85.163.5999 > comp3134-Winter2024.ssh: Flags [P.], seq 1:37, ack 368, win 517, length 36
20:08:47.473811 IP comp3134-Winter2024.ssh > 198.96.85.163.5999: Flags [P.], seq 368:404, ack 37, win 501, length 36
20:08:47.522812 IP comp3134-Winter2024.ssh > 198.96.85.163.5999: Flags [P.], seq 404:1272, ack 37, win 501, length 868
20:08:47.533341 IP 198.96.85.163.5999 > comp3134-Winter2024.ssh: Flags [.], ack 404, win 517, length 0
20:08:47.561419 IP 143.198.197.252.8870 > comp3134-Winter2024.ssh: Flags [.], ack 2484140182, win 21, options [nop,nop,TS val 786797175 ecr 2721955557], length 0
20:08:47.561419 IP 143.198.197.252.8870 > comp3134-Winter2024.ssh: Flags [P.], seq 0:976, ack 1, win 21, options [nop,nop,TS val 786797175 ecr 2721955557], length 976
20:08:47.561560 IP comp3134-Winter2024.ssh > 143.198.197.252.8870: Flags [P.], seq 1:1113, ack 0, win 509, options [nop,nop,TS val 2721955805 ecr 786797175], length 1112
20:08:47.589141 IP 198.96.85.163.5999 > comp3134-Winter2024.ssh: Flags [.], ack 1272, win 514, length 0
20:08:47.602166 IP comp3134-Winter2024.ssh > 143.198.197.252.8870: Flags [.], ack 976, win 502, options [nop,nop,TS val 2721955846 ecr 786797175], length 0
^C
14 packets captured
19 packets received by filter
0 packets dropped by kernel
